"Submission ID","Respondent ID","Submitted at","Name","College Name","Department","e-mail ","Phone Number","Events ","Events  (EconoSpeak-26 (Spot Speech Competition))"
"rjXV7N2","0QEKPKA","2026-02-07 09:01:45","MOHAMMED SINAN ","GRACE VALLEY COLLEGE OF ARTS AND SCIENCE ","BCA","sinanbinzaid7866@gmail.com","+919061108042","EconoSpeak-26 (Spot Speech Competition)","true"
"J9yVMzJ","0QEXYpN","2026-02-08 06:20:59","Raihana uk ","MES ponnanni ","B.voc fashion designing and management ","ukraihana10@gmail.com","+919895879565","EconoSpeak-26 (Spot Speech Competition)","true"
"GxMYKRj","pbL8yjq","2026-02-08 10:16:39","V A Nahala Abdul latheef","Vidya Academy of Science and Technology","Electronics and Communication","nahalalatheef3017@gmail.vom","+918089618980","EconoSpeak-26 (Spot Speech Competition)","true"
"pbgk2jZ","2E4qV8V","2026-02-09 05:58:18","Zahra Rahman ","GRACEVALLEY ","BA ECONOMICS ","raheena1888@gmail.com","+918590362881","EconoSpeak-26 (Spot Speech Competition)","true"
"rjXvjRo","VLZRXjv","2026-02-09 06:52:51","Muhammed Arshad Chellapparamban ","Madin Arts and Science College ","BA ENGLISH ","Arshu0549@gmail.com","+917034532567","EconoSpeak-26 (Spot Speech Competition)","true"
"44ZzjNb","kdYDodd","2026-02-09 07:55:05","Riga Babu","Maharajas college, ernakulam","Political science","rigababualakode@gmail.com","+919447481539","EconoSpeak-26 (Spot Speech Competition)","true"